myths of weight loss are plentiful  researcher says,nytimes
the iphone 5s s fingerprint scanner was hacked  but i m not worried,nytimes
string matching algorithms and comparison,github
amazon says long term and means it,nytimes
for cooler chips  follow the grooves,nytimes
defending the open internet,nytimes
wikimedia s 2007 financials posted,techcrunch
amazon taking on paypal and checkout,techcrunch
complete x86 x64 jit and remote assembler for c  ,github
why i absolutely love java,github
the post katrina classroom  how new orleans is using the free market to reform schools,nytimes
download any soundcloud song,github
bye bye  long tail,techcrunch
as competition wanes  amazon cuts back discounts,nytimes
keen on  douglas rushkoff  present shock   when everything happens now  tctv ,techcrunch
website mirror by proxy,github
jeff bezos puts $3 million into kongregate  a social gaming website,techcrunch
angularstrap - bootstrap directives for angularjs,github
how lynda.com hit $70m in revenue without a penny from investors,techcrunch
hacker friendly tool to make slideshows in 30 seconds,github
confirmed  the groupon google deal is off,techcrunch
economy got you in the dumps  get a life coach with noomii,techcrunch
small wrapper that  fixes  pbcopy in tmux on os x,github
what is micro python ,github
as prostitutes turn to craigslist  law takes notice,nytimes
app that creates coffee shop hum and helps concentration,nytimes
launchy - launching cross-platform applications in a fire and forget manner,github
americans are finally eating less,nytimes
uber ceo  i think i ve got 20 000 years of jail time in front of me,techcrunch
samsung expands gear smartwatch compatibility   to galaxy s4  s3,techcrunch
walmart mobile node.js setup  2013 ,github
foxconn bears the brunt of ivory tower assault on capitalism,techcrunch
massive online courses enroll an average of 43 000 students  10  completion,techcrunch
cappuccino  yc winter 08  brings cocoa-like programming to the web,techcrunch
salesforce.com to announce cross-company instant messaging for chatter,techcrunch
google admob adds windows phone 7 sdk  html5   tablet support for ios   android,techcrunch
show hn  easy file-based api mocking with connect-mock,github
two 25-year-old american entrepreneurs launch a groupon clone in france ,techcrunch
chinese dissident  jailed on evidence provided by yahoo  is freed  2012 ,nytimes
the third disruptive wave  tcdisrupt ,techcrunch
locus.js 1.0,github
the parable of the wheel,techcrunch
nyt s david pogue reviews iphone 4s  new iphone conceals sheer magic,nytimes
twitter humiliates myspace,techcrunch
please remove mitsuhiko  ,github
show hn  a b testing in two shortcodes with wordpress,github
ruby vs javascript,github
show hn  flatuikit - flat ui components for ios,github
bootcamp  an open-source enterprise social network,github
diy music management platform nimbit raises $1.25 million,techcrunch
google s first 1337 cash prize for a chrome bug,techcrunch
please hammer don t hurt them - m.c. hammer s search engine,techcrunch
more awesome than money,nytimes
slide and vh1 team up to annoy the hell out of you,techcrunch
easily keep track of version controlled config files and installed packages,github
i m sick of this,github
meerkat launches developer platform to differentiate from periscope,techcrunch
facebook veterans in venture capital spotlight ,nytimes
quora goes  more  viral,techcrunch
net neutrality debate  access and costs are top issues,nytimes
angular-http-faker back end less http request module,github
autojump  easily navigate directories from the command line,github
show hn  open-sourcing my cv template  helvetica  xetex  tikz   biblatex ,github
more people got their news online yesterday than from a print newspaper,techcrunch
facebook loses appeal on new york search warrants,nytimes
 cleanupgithub pull request on the linux kernel,github
slideshare axes its freemium model  makes  pro  features like analytics free,techcrunch
palladium 1.0 released  framework for turning python ml models into services,github
javascript - named function expressions and the ie dilemma,github
zynga reports q3 revenue of $317m  up 12.7  in after-hours on casino push,techcrunch
ruby2 rails4 bootstrap postgresql starter app,github
at t  verizon  t-mobile join forces in new mobile payments venture called  isis ,nytimes
facebook combines atlas  audience network  and liverail into an adtech voltron,techcrunch
 gosh  is security theater for piped shell scripts,github
skype adds video apis  officially launches app directory,techcrunch
hoa eventsource  a complete server to push events  server-sent events ,github
is candy evil or just misunderstood ,nytimes
paypal launches in-app payment library for android,techcrunch
hn api   issue  122,github
what paintbrush makers know about how to beat china,nytimes
deepdreamvideo,github
photos of developer desktops - yield the dog,github
the samsung doth advertise too much  methinks,techcrunch
amazon hooks college students with a free year of amazon prime,techcrunch
for couples split by distance  two screens can blink as one,nytimes
microsoft reveals a web-based software system,nytimes
a simple yet powerful open source markdown editor,github
pnchart - a simple and beautiful chart lib used in piner for ios,github
bittorrent open sources dht bootstrap server,github
zeus  preload rails for sub-second startup times,github
show hn  redis dashboard,github
not only was steve jobs sick  he had a liver transplant.,techcrunch
show hn  storage.js - light-weight localstorage jquery wrapper for quick usage ,github
okta becomes a unicorn,techcrunch
april fools  facebook considers adding the hate button ,techcrunch
super fun kid time  techcrunch disrupt hackathon ,techcrunch
startup weekend on the turkish border unites two countries  entrepreneurs,techcrunch
airborne   rspec driven api testing framework,github
adobe blurs line between pc and web,nytimes
diaspora revealed  sparse  but clean  source code released,techcrunch
crash spurs interest in real-time flight data,nytimes
undercutting startups  walmart launches food subscription service for $7 month,techcrunch
let them eat cash,nytimes
the man who saw america,nytimes
six apart  movable type  typepad  allegedly being acquired by videoegg,techcrunch
tigen automated test generator for c programs  static-analysis,github
eelmail   email server on node.js,github
dna test for babies pinpoints mutations  speeding diagnosis,nytimes
penguin suspends e-book availability to libraries,nytimes
show hn   live spreadsheet with cryptocurrency comparison,github
process.nexttick vs. setimmediate,github
number of $1  $5 and $10 bills printed is declining,nytimes
bing and google are always trying to outdo each other - lucky us,nytimes
rails 4.0.0.rc2,github
